<?xml version="1.0" encoding="UTF-8"?>
<!-- Invalid because collection3bis.xsd puts the xs:key on single element and
the 2nd author overrides the first. -->
<col:collection xmlns:col="http://example.com/ns/collection"
            xmlns:xsi="http://www.w3.org/2001/XMLSchema-instance"
            xsi:schemaLocation="http://example.com/ns/collection collection3bis.xsd">
	<author dn="PAR">
		<name>Pierre-Auguste Renoir</name>
		<born>1841-02-25</born>
		<dead>1919-12-03</dead>
		<qualification>painter</qualification>
	</author>
	<author dn="JM">
		<name>Joan Mir√≥</name>
		<born>1893-04-20</born>
		<dead>1983-12-25</dead>
		<qualification>painter, sculptor and ceramicist</qualification>
	</author>
	<object id="b0836217462" available="true">
		<position>1</position>
		<title>The Umbrellas</title>
		<year>1886</year>
		<author>PAR</author>
        <estimation>10000.00</estimation>
	</object>
	<object id="b0836217463" available="true">
		<position>2</position>
		<title/>
		<year>1925</year>
		<author>JM</author>
	</object>
</col:collection>
